{
  "kind": "question",
  "version": "1.0",
  "slug": "default-true-false-question-slug",
  "theme": { "slug": "default-theme" },
  "subthemes": [ { "slug": "default-subtheme1" }, { "slug": "default-subtheme2" } ],
  "tags": [ { "slug": "default-tag1" }, { "slug": "default-tag2" } ],
  "qtype": "true_false",
  "difficulty": "beginner",
  "estimated_seconds": 10,
  "shuffle_answers": false,
  "i18n": {
    "fr": { "title": "Titre vrai/faux", "stem": "Cette affirmation est-elle vraie ou fausse?", "explanation": "Explication par défaut à remplacer par votre explication détaillée." },
    "en": { "title": "True/False Title", "stem": "Is this statement true or false?", "explanation": "Default explanation to replace with your detailed explanation." },
    "es": { "title": "Titulo verdadero/falso", "stem": "Es verdadera o falsa esta afirmacion?", "explanation": "Explicación por defecto a reemplazar con su explicación detallada." }
  },
  "answers": [
    { "slug": "true", "is_correct": true, "i18n": { "fr": { "label": "Vrai" }, "en": { "label": "True" }, "es": { "label": "Verdadero" } } },
    { "slug": "false", "is_correct": false, "i18n": { "fr": { "label": "Faux" }, "en": { "label": "False" }, "es": { "label": "Falso" } } }
  ],
  "sources": [
    "https://example.com/default-source"
  ]
}
